<?xml version="1.0" encoding="UTF-8"?>
<vinyl_shop xmlns:xsi="http://www.w3.org/2001/XMLSchema-instance"
    xsi:schemaLocation="urn:cecj02:namespace:vinyl_shop vinyl_shop.xsd"
    xmlns="urn:cecj02:namespace:vinyl_shop">
    <autor>
        <jmeno>Jiří</jmeno>
        <prijmeni>Čech</prijmeni>
        <email>cecj02@vse.cz</email>
    </autor>
    <hudebni_dila>
        <dilo>
            <nazev>Clockwork</nazev>
            <obrazek src="images/clockwork.jpg" />
            <umelci>
                <umelec>Stakka</umelec>
                <umelec>Skynet</umelec>
            </umelci>
            <vydavatel>
                <nazev>Underfire Recordings</nazev>
                <zeme>UK</zeme>
            </vydavatel>
            <vydano>
                <den>20</den>
                <mesic>9</mesic>
                <rok>2001</rok>
            </vydano>
            <kod>UDFRLP04</kod>
            <typ>Album</typ>
            <format>2xLP</format>
            <zanry>
                <zanr>Drum &amp; Bass</zanr>             
            </zanry>
            <stav>M</stav>
            <cena mena="CZK">690</cena>
            <dostupnost>Skladem</dostupnost>
            <obsah>
                <vinyl>
                    <strana>
                        <kod>A</kod>
                        <skladba>
                            <nazev>Decoy</nazev>
                            <delka jednotka="s">425</delka>
                        </skladba>
                    </strana>
                    <strana>
                        <kod>B</kod>
                        <skladba>
                            <cislo>1</cislo>
                            <nazev>Biosfear</nazev>
                            <delka jednotka="s">260</delka>
                        </skladba>    
                        <skladba>
                            <cislo>2</cislo>
                            <nazev>So Confused</nazev>
                            <delka jednotka="s">283</delka>
                        </skladba> 
                    </strana>      
                </vinyl>
                <vinyl>
                    <strana>
                        <kod>C</kod>
                        <skladba>
                            <nazev>Clockwork</nazev>
                            <delka jednotka="s">425</delka>
                        </skladba>                       
                    </strana>
                    <strana>
                        <kod>D</kod>
                        <skladba>
                            <nazev>Isolation</nazev>
                            <delka jednotka="s">268</delka>
                            <remix>
                                <umelec>Keaton</umelec>
                            </remix>
                        </skladba>
                    </strana>
                </vinyl>
            </obsah>
        </dilo>
        <dilo>
            <nazev>Dark Side Of The Moon</nazev>
            <obrazek src="images/dark_side_of_the_moon.jpg" />
            <umelci>
                <umelec>Pink Floyd</umelec>
            </umelci>
            <vydavatel>
                <nazev>Harvest</nazev>
                <zeme>US</zeme>
            </vydavatel>
            <vydano>
                <rok>1973</rok>
            </vydano>
            <kod>SMAS 11163</kod>
            <typ>Album</typ>
            <format>LP</format>
            <zanry>
                <zanr>Classic Rock</zanr>
                <zanr>Progressive Rock</zanr>             
            </zanry>
            <stav>NM</stav>
            <cena mena="CZK">720</cena>
            <dostupnost>Skladem</dostupnost>
            <obsah>
                <vinyl>
                    <strana>
                        <kod>A</kod>
                        <skladba>
                            <cislo>1</cislo>
                            <nazev>Speak To Me</nazev>
                            <delka jednotka="s">73</delka>
                        </skladba>
                        <skladba>
                            <cislo>2</cislo>
                            <nazev>Breathe</nazev>
                            <delka jednotka="s">116</delka>
                        </skladba>
                        <skladba>
                            <cislo>3</cislo>
                            <nazev>On The Run</nazev>
                            <delka jednotka="s">215</delka>
                        </skladba>
                        <skladba>
                            <cislo>4</cislo>
                            <nazev>Time</nazev>
                            <delka jednotka="s">425</delka>
                        </skladba>
                        <skladba>
                            <cislo>5</cislo>
                            <nazev>The Great Gig In The Sky</nazev>
                            <delka jednotka="s">298</delka>
                        </skladba>
                    </strana>
                    <strana>
                        <kod>B</kod>
                        <skladba>
                            <cislo>1</cislo>
                            <nazev>Money</nazev>
                            <delka jednotka="s">415</delka>
                        </skladba>
                        <skladba>
                            <cislo>2</cislo>
                            <nazev>Us And Them</nazev>
                            <delka jednotka="s">216</delka>
                        </skladba>
                        <skladba>
                            <cislo>3</cislo>
                            <nazev>Any Colour You Like</nazev>
                            <delka jednotka="s">346</delka>
                        </skladba>
                        <skladba>
                            <cislo>4</cislo>
                            <nazev>Brain Damage</nazev>
                            <delka jednotka="s">298</delka>
                        </skladba>
                        <skladba>
                            <cislo>5</cislo>
                            <nazev>Eclipse</nazev>
                            <delka jednotka="s">179</delka>
                        </skladba>
                    </strana>      
                </vinyl>
            </obsah>
        </dilo>
        <dilo>
            <nazev>Travel The Galaxy</nazev>
            <obrazek src="images/travel_the_galaxy.jpg" />
            <umelci>
                <umelec>Ed Rush</umelec>
                <umelec>Optical</umelec>
            </umelci>
            <vydavatel>
                <nazev>Virus Recordings</nazev>
                <zeme>UK</zeme>
            </vydavatel>
            <vydano>
                <den>11</den>
                <mesic>5</mesic>
                <rok>2009</rok>
            </vydano>
            <kod>VRS007LP</kod>
            <typ>Album</typ>
            <format>3xLP</format>
            <zanry>
                <zanr>Drum &amp; Bass</zanr>             
            </zanry>
            <stav>VG</stav>
            <cena mena="CZK">1190</cena>
            <dostupnost>Na obědnání</dostupnost>
            <obsah>
                <vinyl>
                    <strana>
                        <kod>A</kod>
                        <skladba>
                            <nazev>City 17</nazev>
                            <delka jednotka="s">525</delka>
                            <featuring>
                                <umelec>Ryme Tyme</umelec>
                            </featuring>
                        </skladba>
                    </strana>
                    <strana>
                        <kod>B</kod>
                        <skladba>
                            <nazev>Schranders Dice</nazev>
                            <delka jednotka="s">260</delka>
                        </skladba>     
                    </strana>      
                </vinyl>
                <vinyl>
                    <strana>
                        <kod>C</kod>
                        <skladba>
                            <nazev>Chubrub</nazev>
                            <delka jednotka="s">425</delka>
                        </skladba>                       
                    </strana>
                    <strana>
                        <kod>D</kod>
                        <skladba>
                            <nazev>Snaggletooth</nazev>
                            <delka jednotka="s">558</delka>
                        </skladba>
                    </strana>
                </vinyl>
                <vinyl>
                    <strana>
                        <kod>E</kod>
                        <skladba>
                            <nazev>G-Force Jesus</nazev>
                            <delka jednotka="s">312</delka>
                        </skladba>                       
                    </strana>
                    <strana>
                        <kod>F</kod>
                        <skladba>
                            <nazev>Titanium</nazev>
                            <delka jednotka="s">497</delka>
                        </skladba>
                    </strana>
                </vinyl>
            </obsah>
        </dilo>
        <dilo>
            <nazev>Clandestino</nazev>
            <obrazek src="images/clandestino.jpg" />
            <umelci>
                <umelec>Manu Chao</umelec>
            </umelci>
            <vydavatel>
                <nazev>Virgin</nazev>
                <zeme>FR</zeme>
            </vydavatel>
            <vydano>
                <mesic>3</mesic>
                <rok>1998</rok>
            </vydano>
            <kod>7243 8 45783 1 2</kod>
            <typ>Album</typ>
            <format>LP</format>
            <zanry>
                <zanr>Rock</zanr>
                <zanr>Reggae</zanr>             
            </zanry>
            <stav>G</stav>
            <cena mena="CZK">1560</cena>
            <dostupnost>Skladem</dostupnost>
            <obsah>
                <vinyl>
                    <strana>
                        <kod>A</kod>